{
  "rule_name": "allow_access_to_nginx",
  "description": "traffic flow from VM1 to VM2",
  "source_zone": ["trust"],
  "destination_zone": ["untrust"],
  "source_address": ["172.16.0.0/24"],
  "destination_address": ["172.19.0.0/24"],
  "application": ["web-browsing", "ssl"],
  "service": ["tcp-80", "tcp-443", "tcp-80"],
  "action": "allow",
  "log_at_session_start": true,
  "log_at_session_end": true,
  "position": "top",
  "tag": ["gitops-demo", "auto-deployed"],
  "metadata": {
    "created_by": "GitHub Actions",
    "project": "Palo Alto GitOps Demo",
    "environment": "production",
    "vm1_name": "user01workstation",
    "vm1_ip": "172.19.1.5",
    "vm2_name": "web01application",
    "vm2_ip": "172.19.2.5",
    "ticket_id": "DEMO-001",
    "requested_by": "Subodh"
  }
}
