{
  "rule_name": "Allow-access-to-Web-Application",
  "description": "GitOps Demo - Allow user01workstation to access web01application nginx server",
  "source_zone": ["trust"],
  "destination_zone": ["untrust"],
  "source_address": ["172.19.1.5"],
  "destination_address": ["172.19.2.5"],
  "application": ["web-browsing", "ssl"],
  "service": ["tcp-80", "tcp-443"],
  "action": "allow",
  "log_at_session_start": true,
  "log_at_session_end": true,
  "position": "top",
  "tag": ["gitops-demo", "auto-deployed"],
  "metadata": {
    "created_by": "GitHub Actions",
    "project": "Palo Alto GitOps Demo",
    "environment": "production",
    "vm1_name": "user01workstation",
    "vm1_ip": "172.19.1.5",
    "vm2_name": "web01application",
    "vm2_ip": "172.19.2.5",
    "ticket_id": "DEMO-001",
    "requested_by": "Subodh"
  }
}