{
  "rule_name": "allow_rule_to_access_web",
  "description": "As per service request",
  "source_zone": [
    "trust"
  ],
  "destination_zone": [
    "dmz"
  ],
  "source_address": [
    "web01application"
  ],
  "destination_address": [
    "user01workstation"
  ],
  "application": [
    "web-browsing",
    "ssl",
    "any"
  ],
  "service": [
    "application-default"
  ],
  "action": "allow",
  "log_at_session_start": true,
  "log_at_session_end": true,
  "position": "top",
  "tag": [
    "gitops-managed",
    "self-service"
  ],
  "metadata": {
    "created_by": "John",
    "created_via": "Self-Service Portal",
    "timestamp": "2026-02-06 05:20:34",
    "request_id": "SR-1001",
    "target_firewall": "fw1toyota123",
    "business_justification": "As per service request"
  }
}