{
  "rule_name": "ngfw_rule32_db_to_web_server",
  "description": "Testing",
  "source_zone": [
    "trust"
  ],
  "destination_zone": [
    "dmz"
  ],
  "source_address": [
    "172.19.1.5"
  ],
  "destination_address": [
    "web01application"
  ],
  "application": [
    "web-browsing",
    "ssl",
    "any"
  ],
  "service": [
    "application-default"
  ],
  "action": "allow",
  "log_at_session_start": true,
  "log_at_session_end": true,
  "position": "top",
  "tag": [
    "gitops-managed",
    "self-service"
  ],
  "metadata": {
    "created_by": "John",
    "created_via": "Self-Service Portal",
    "timestamp": "2026-01-30 13:09:29",
    "request_id": "SR-1002",
    "target_firewall": "fw1toyota123",
    "business_justification": "Testing"
  }
}