{
  "rule_name": "New_York",
  "description": "test",
  "source_zone": [
    "trust"
  ],
  "destination_zone": [
    "untrust"
  ],
  "source_address": [
    "172.19.1.5"
  ],
  "destination_address": [
    "172.19.2.5"
  ],
  "application": [
    "any"
  ],
  "service": [
    "application-default"
  ],
  "action": "allow",
  "log_at_session_start": true,
  "log_at_session_end": true,
  "position": "top",
  "tag": [
    "gitops-managed",
    "self-service"
  ],
  "metadata": {
    "created_by": "test101",
    "created_via": "Self-Service Portal",
    "timestamp": "2026-01-29 19:07:47",
    "request_id": "SR-1001",
    "business_justification": "test"
  }
}