{
  "rule_name": "palo_alo_rule12",
  "description": "Service Request to allow access",
  "source_zone": [
    "untrust"
  ],
  "destination_zone": [
    "trust"
  ],
  "source_address": [
    "user01workstation"
  ],
  "destination_address": [
    "web01application"
  ],
  "application": [
    "web-browsing",
    "ssl"
  ],
  "service": [
    "application-default"
  ],
  "action": "allow",
  "log_at_session_start": true,
  "log_at_session_end": true,
  "position": "top",
  "tag": [
    "gitops-managed",
    "self-service"
  ],
  "metadata": {
    "created_by": "John",
    "created_via": "Self-Service Portal",
    "timestamp": "2026-01-30 14:07:10",
    "request_id": "SR-1001",
    "target_firewall": "fw1toyota123",
    "business_justification": "Service Request to allow access"
  }
}